{
  "schema_version": 1,
  "kind": "verification",
  "target": {
    "repository": "D-Robotics/rdk_model_zoo",
    "commit": null,
    "dirty": null,
    "patch_sha256": null,
    "sample_path": null
  },
  "checks": [
    {
      "id": "sample-smoke",
      "required": true,
      "level": "board",
      "purpose": "smoke",
      "status": "not-run",
      "scope": {
        "platform": null,
        "model_variant": null,
        "task": null,
        "runtime": null,
        "model_sha256": null,
        "input_sha256": null
      },
      "environment": {
        "host": null,
        "board": null,
        "os": null,
        "runtime_version": null
      },
      "execution": null,
      "result": null,
      "evidence": [],
      "reason": "模板：尚未执行。使用时填写目标身份和实际阻断条件。"
    }
  ]
}
